Profile,Folder Name,LinkedIn ID,Full Name,First Name,Last Name,About,Country,City,Company,Company Logo Url,Current Position,Current Position Experience,Current Company Industry,Past Position,Past Position Experience,Skills,Education,Profile Image Url,Primary Work Email,Personal Email,Other Email,Email Status,Work Phone,Personal Phone,Other Phone,Template,Assigned Sequence Status,Update From LinkedIn,Created At,Updated Date,Lead Status,Profile LinkedIn Url,Company Domain,Company Size
YuvaRani Parthasarathy,Imran Syed,yuvarani-parthasarathy-669315123,YuvaRani Parthasarathy,YuvaRani,Parthasarathy,,"Tamil Nadu, India",Tamil Nadu,Wipro · Full-time,https://media.licdn.com/dms/image/v2/D560BAQEurlKh_zGKUQ/company-logo_100_100/company-logo_100_100/0/1727788620493/wipro_logo?e=1736380800&v=beta&t=-j_8ZWZYFO4K2Fwu0pm0RlVnTOgnxicBYdfZKHjfVpk,Senior Executive - TA,Jul 2024 - Present · 4 mos,Wipro · Full-time,Talent Coordinator,Jan 2022 - Aug 2024 · 2 yrs 8 mos,,"Master of Business Administration (M.B.A.), Human resources and marketing",https://media.licdn.com/dms/image/v2/C5103AQE88gj69DQc9w/profile-displayphoto-shrink_400_400/profile-displayphoto-shrink_400_400/0/1573718809935?e=1733961600&v=beta&t=d9syfljbOgfKVBH5BvVOH5ASVer9lcdTjw2vfCPMNv0,yuvarani.parthasarathy@wipro.com,,yuvarani.parthasarathy@wipro.com,notSent,"+91 802 844 0054,848-297-1727,+1-615-910-2373,011 061 6500,+4570277700,+91 120 3360111,+91 124 308 4000,+91 141-4040841,+91 821 3983082,+91 484 3054949,+91 891 3043333",,"+91 802 844 0054,848-297-1727,+1-615-910-2373,011 061 6500,+4570277700,+91 120 3360111,+91 124 308 4000,+91 141-4040841,+91 821 3983082,+91 484 3054949,+91 891 3043333",,No,10/8/2024,10/8/2024,10/8/2024,,https://www.linkedin.com/in/yuvarani-parthasarathy-669315123,,
Jeffery Jonathan,Imran Syed,jeffery-jonathan-9067b4324,Jeffery Jonathan,Jeffery,Jonathan,"As a Senior UI/UX Designer, I bring creativity, technology, and a deep understanding of user behavior to every project I tackle. With over 4 years of experience, I specialize in designing seamless, user-friendly interfaces that solve real-world problems. My journey to digital design has equipped me with a unique blend of analytical thinking and empathy, ensuring every design decision I make enhances the user experience.Let’s connect and explore how we can create transformative digital experiences together!","New York, New York, United States",New York,Jarvis Reach · Full-time,https://media.licdn.com/dms/image/v2/D560BAQFdEJWIQRlbDA/company-logo_100_100/company-logo_100_100/0/1719257232885/jarvis_reach_logo?e=1736380800&v=beta&t=0C7bn8nmdrIg541JCvsXpTp6Y3yMSiMi3UcopL2EaDI,Senior UI/UX Designer,Feb 2022 - Present · 2 yrs 9 mos,Jarvis Reach · Full-time,Junior UI/UX Designer,Dec 2019 - Sep 2021 · 1 yr 10 mos,", ",Bachelor of Engineering - BE,https://media.licdn.com/dms/image/v2/D5603AQGb_BYhUhU5TQ/profile-displayphoto-shrink_400_400/profile-displayphoto-shrink_400_400/0/1727170830173?e=1733961600&v=beta&t=1qanc9K-HvvSudY2aaee8HoeE050_6kELotzkofBLZE,,jarvisreach@gmail.com,,notSent,"780.498.1231,780.498.1266",,"780.498.1231,780.498.1266",,No,10/10/2024,10/10/2024,10/10/2024,,https://www.linkedin.com/in/jeffery-jonathan-9067b4324,,
"Felicia E. Brown, BSN",Imran Syed,felicia-e-brown-bsn-a9b82983,"Felicia E. Brown, BSN",Felicia,"E. Brown, BSN",,"Newark, Delaware, United States",Newark,AstraZeneca,https://media.licdn.com/dms/image/v2/C4E0BAQEuFlOA7pBVJw/company-logo_100_100/company-logo_100_100/0/1663748570969/astrazeneca_logo?e=1736380800&v=beta&t=HgtqRpb2732NL8ei-HMEXRMEF3RYKes6EE6aP5WoYyk,,,AstraZeneca,Marketing Manager,Aug 2020 - Jul 2022 · 2 yrs,", ",,https://media.licdn.com/dms/image/v2/C4E03AQGR4GBEnsjrAQ/profile-displayphoto-shrink_800_800/profile-displayphoto-shrink_800_800/0/1599172513649?e=1733961600&v=beta&t=i61C2HbZc4nvtNzFvCLsUFu2e_s0mCkg0LhYBynMWFM,,,,notSent,"1-800-565-5877,1-800-668-6000,1-800-461-3787,+44 203 749 5000,360 (1-844-275-2360,(844-275-2360,360 (1-844",,"1-800-565-5877,1-800-668-6000,1-800-461-3787,+44 203 749 5000,360 (1-844-275-2360,(844-275-2360,360 (1-844",,No,10/10/2024,10/10/2024,10/11/2024,,https://www.linkedin.com/in/felicia-e-brown-bsn-a9b82983,"10,001+ employees","10,001+ employees"
Samson Evers,Imran Syed,samson-evers-627833102,Samson Evers,Samson,Evers,,United States,United States,Talbots,https://media.licdn.com/dms/image/v2/D560BAQEPlLFtAFugNg/company-logo_100_100/company-logo_100_100/0/1727758502019/talbots_logo?e=1736380800&v=beta&t=Iaf6ZW0SuVbPeyBOQL7piniqcW2Qt6OTgcEuCt_FT6U,,,Talbots,,,", ",,"data:image/gif;base64,R0lGODlhAQABAIAAAAAAAP///yH5BAEAAAAALAAAAAABAAEAAAIBRAA7",samson.evers@talbots.com,,samson.evers@talbots.com,notSent,"1-800-510-6606,1-800-825-2687,800-992-9010",,"1-800-510-6606,1-800-825-2687,800-992-9010",,No,10/10/2024,10/10/2024,10/10/2024,,https://www.linkedin.com/in/samson-evers-627833102,"10,001+ employees","10,001+ employees"
Chris Peck,Imran Syed,chispeck2,Chris Peck,Chris,Peck,Results-focused public affairs professional with extensive experience in energy and the environment. Ability to manage resources and achieve results on complex projects under tight deadlines. Talent for finding creative solutions to challenging problems. Known for maintaining positive outlook under significant pressure. Experienced working in mixed matrix environments. Diversified background in public agency and regulated utility sectors.,Los Angeles Metropolitan Area,Los Angeles Metropolitan Area,Yeomen Enterprises,,Principal,Jan 2016 - Present · 8 yrs 10 mos,Yeomen Enterprises,Public Involvement Specialist,2013 - 2015 · 2 yrs,", ",,https://media.licdn.com/dms/image/v2/C4D03AQFnDW4Pk4BS4g/profile-displayphoto-shrink_400_400/profile-displayphoto-shrink_400_400/0/1516610505150?e=1733961600&v=beta&t=SbS5oHNXfE9QtaBIy0F3xV0SsSML7tCkkwVBjEMUAsI,,cpeck01@gmail.com,,notSent,,,,,No,10/10/2024,10/10/2024,10/22/2024,,https://www.linkedin.com/in/chispeck2,,
Bill McElroy,Imran Syed,billmcelroy,Bill McElroy,Bill,McElroy,"I’m a medicinal chemist with 15 years’ experience in pharma and biotech. My expertise spans novel target identification, creating chemical probes to interrogate biology, screening campaigns, and lead optimization. I’ve been part of and led successful teams that have invented small molecules, Protacs, and unconventional therapeutics for a range of indications.A full list of peer-reviewed publications can be found at: https://www.researchgate.net/profile/William-McElroy",Greater Boston,Greater Boston,Alkermes,https://media.licdn.com/dms/image/v2/D560BAQE_Du_4JbvxEg/company-logo_100_100/company-logo_100_100/0/1719936129244/alkermes_logo?e=1736380800&v=beta&t=KOzfNe0Fw_NPjqX0BY963SI1eCaeZeIxuUzaS6BgkCo,"Director, Medicinal Chemistry",Dec 2021 - Present · 2 yrs 11 mos,Alkermes,"Principal Scientist, Medicinal Chemistry",2020 - 2021 · 1 yr,", ","BS, Chemistry; Minor, Mathematics",https://media.licdn.com/dms/image/v2/D4E03AQGV14sVRDYFRA/profile-displayphoto-shrink_400_400/profile-displayphoto-shrink_400_400/0/1676810704243?e=1733961600&v=beta&t=ecQEVAdw-_uAMt9LUHIoKaF80NoTjROITp7McQoppHM,bill.mcelroy@alkermes.com,,bill.mcelroy@alkermes.com,notSent,"1-888-235-8008,1-571-599-2702,+1-617-494-0171",,"1-888-235-8008,1-571-599-2702,+1-617-494-0171",,No,10/10/2024,10/10/2024,10/10/2024,,https://www.linkedin.com/in/billmcelroy,,
"Brittain Rhodus, RN, BSN",Imran Syed,brittain-rhodus-rn-bsn-6445b2103,"Brittain Rhodus, RN, BSN",Brittain,"Rhodus, RN, BSN","I am an experienced sales representative with a demonstrated history of winning in the medical device and pharmaceutical industry. I have experience with market access and pull through for top Medicare and commercial plans in Louisiana. I have experience in OBGYN, urology, UROGYN, and critical care spaces. I have an active nursing license in the state of Louisiana. ","Prairieville, Louisiana, United States",Prairieville,"Sumitomo Pharma America Holdings, Inc. · Full-time",https://media.licdn.com/dms/image/v2/C4E0BAQGQ85lWADSABg/company-logo_100_100/company-logo_100_100/0/1648813263445/sumitomo_dainippon_pharma_america_inc_logo?e=1736380800&v=beta&t=YLWL9Pn4R2ThcJMFjO1oIlkPfe3iBffkrUOA0zHI16w,Territory Sales Manager,Nov 2022 - Present · 2 yrs,"Sumitomo Pharma America Holdings, Inc. · Full-time",Territory Manager,Oct 2022 - Jul 2023 · 10 mos,", ",,"data:image/gif;base64,R0lGODlhAQABAIAAAAAAAP///yH5BAEAAAAALAAAAAABAAEAAAIBRAA7",brittain.rhodus@hologic.com,,brittain.rhodus@hologic.com,notSent,,,,,No,10/10/2024,10/10/2024,10/10/2024,,https://www.linkedin.com/in/brittain-rhodus-rn-bsn-6445b2103,,
KEERTHANA SARAVANAN,Imran Syed,keerthana-saravanan-4b1251257,KEERTHANA SARAVANAN,KEERTHANA,SARAVANAN,,"Bengaluru, Karnataka, India",Bengaluru,EDVEDHA · Full-time,https://media.licdn.com/dms/image/v2/D560BAQGykRMWdZrJSA/company-logo_100_100/company-logo_100_100/0/1685174402820?e=1737590400&v=beta&t=d-JweKdbcJWIVIeYB5JTYZrMfNmYlX1ourUmfoNIroI,Human Resources Executive,Oct 2024 - Present · 1 mo,EDVEDHA · Full-time,Digital Marketing Executive,Mar 2024 - Jun 2024 · 4 mos,"Human Resources Executive at EDVEDHA, Human Resources Executive at EDVEDHA","HSC, Maths-Bio",https://media.licdn.com/dms/image/v2/D5635AQGhiVRuETjMEg/profile-framedphoto-shrink_400_400/profile-framedphoto-shrink_400_400/0/1729669590156?e=1730286000&v=beta&t=LeX5WKfyfiAqkyDsxffxW4Dnw1y57-gZx0mfqklYje0,,keerthanasaravanan944@gmail.com,,notSent,"+91 7981969261,+91-7981969261",,"+91 7981969261,+91-7981969261",,No,10/23/2024,10/23/2024,10/23/2024,,https://www.linkedin.com/in/keerthana-saravanan-4b1251257,,