Profile,Folder Name,LinkedIn ID,Full Name,First Name,Last Name,About,Country,City,Company,Company Logo Url,Current Position,Current Position Experience,Current Company Industry,Past Position,Past Position Experience,Skills,Education,Profile Image Url,Primary Work Email,Personal Email,Other Email,Email Status,Work Phone,Personal Phone,Other Phone,Template,Assigned Sequence Status,Update From LinkedIn,Created At,Updated Date,Lead Status,Profile LinkedIn Url,Company Domain,Company Size
satish kumar,My First Folder,satish-kumar-873721118,satish kumar,satish,kumar,"Experienced Human Resources Recruiter with a demonstrated history of working in the staffing and recruiting industry. Skilled in Microsoft Excel, Customer Service, Microsoft Word, Sales, and Strategic Planning. Strong human resources professional graduated from montessori heigh school. ","Bengaluru, Karnataka, India",Bengaluru,HCL Technologies,https://media.licdn.com/dms/image/v2/C4D0BAQF-RIoeeMTMKQ/company-logo_100_100/company-logo_100_100/0/1664197008220/hcltech_logo?e=1736380800&v=beta&t=PyNxtR2aMWhIyvE6aw6IEjUrulD3hP-iKhrqYvhliWM,HR Executive,Nov 2018 - Present · 6 yrs,HCL Technologies,,,", ",2004 - 2008,https://media.licdn.com/dms/image/v2/C5103AQHllkL-kXI_mA/profile-displayphoto-shrink_400_400/profile-displayphoto-shrink_400_400/0/1517583136618?e=1733961600&v=beta&t=TKz5FMGh-TyexlfKO6G0NnQgjvcTLAE2YlTRrWlUk3Q,skumar@hcltech.com,satishds56@gmail.com,skumar@hcltech.com,notSent,+91-120-252-0917,9494939356,+91-120-252-0917,,No,10/7/2024,10/7/2024,10/7/2024,,https://www.linkedin.com/in/satish-kumar-873721118,"10,001+ employees","10,001+ employees"
Daril Benisha D,My First Folder,darilbenisha-d,Daril Benisha D,Daril,Benisha D,"Anchoring the Citroën EV and Jeep initiatives at Stellantis, my role as a Design Release Engineer is to own the product from development to life cycle management and project milestone marking. Our team's command over CANoe and electrical layouts is pivotal in propelling the Electronic Control Units' design forward, driving towards automotive innovation. Product Lifecycle management plays a vital role in my current position.With the expertise in semiconductors risk mitigation, we're steering sustainable progress. It's the strategy to deliver vehicles that redefine industry benchmarks. Eliminating the legacy chipsets and improvising new technologies to manage the risk of chip obsolescence in market for future development.","Chennai, Tamil Nadu, India",Chennai,Stellantis,https://media.licdn.com/dms/image/v2/C4D0BAQHURyWugU5A4g/company-logo_100_100/company-logo_100_100/0/1630577492034/stellantis_logo?e=1736380800&v=beta&t=P9KsKHPL_4gDnyPNQUgl8_xrdG4PNCCe37H3ygkXMhs,Design Release Engineer,Mar 2024 - Present · 8 mos,Stellantis,Applicative engineer,Dec 2023 - May 2024 · 6 mos,", ",Master of Business Administration - MBA,"data:image/gif;base64,R0lGODlhAQABAIAAAAAAAP///yH5BAEAAAAALAAAAAABAAEAAAIBRAA7",daril.benisha@stellantis.com,,daril.benisha@stellantis.com,notSent,1-800-334-9200,,1-800-334-9200,,No,10/7/2024,10/7/2024,10/7/2024,,https://www.linkedin.com/in/darilbenisha-d,"501-1,000 employees","501-1,000 employees"
Manisha Patankar,My First Folder,manisha-patankar-39aaa616a,Manisha Patankar,Manisha,Patankar,"10+ years of experience in Software Testing across Insurance, Retail/E-commerce & Telecom domains. Strong knowledge of SDLC, STLC, Defect life cycle, agile and scrum framework. Good experience on Salesforce Testing. (Sales Cloud, Manufacturing cloud)Good communication skills. Strong analytical and problem-solving skills.","Pune, Maharashtra, India",Pune,Marlabs LLC · Full-time,https://media.licdn.com/dms/image/v2/D560BAQGYCtwQrMH1nA/company-logo_100_100/company-logo_100_100/0/1720097209278/marlabs_logo?e=1736380800&v=beta&t=jD1Ds_STX65kQsIN8ZV398iZjI-ba5KTUy_RfWf1ztw,Technical Lead QA,Dec 2022 - Present · 1 yr 11 mos,Marlabs LLC · Full-time,Senior Test Analyst,May 2021 - Sep 2022 · 1 yr 5 mos,", ",,https://media.licdn.com/dms/image/v2/C4D03AQHFLQpRMGacwQ/profile-displayphoto-shrink_400_400/profile-displayphoto-shrink_400_400/0/1623060020153?e=1733961600&v=beta&t=5Xtz37Rzav6WP0VkYtpp8i7G-NT_J5HIcGO6-2Nddeg,,manisha1191@gmail.com,,notSent,,,,,No,10/7/2024,10/7/2024,10/9/2024,,https://www.linkedin.com/in/manisha-patankar-39aaa616a,201-500 employees,201-500 employees
Sathish A R,My First Folder,sathish-a-r-933b48150,Sathish A R,Sathish,A R,"Software Developer in Test with a demonstrated history of working in the Saas product. Skilled in Test Management, Java, Test Planning, API testing, Google workspace and Microsoft office","Bengaluru, Karnataka, India",Bengaluru,Kaplan,https://media.licdn.com/dms/image/v2/D4E0BAQGdhvUhQ2a_IQ/company-logo_100_100/company-logo_100_100/0/1719847153307/kaplan_logo?e=1736380800&v=beta&t=9vG2RZjpGRqpUvXhs9d568Hd39v3LLHdMzgIq30hROM,Senior QA Engineer I,Jul 2024 - Present · 4 mos,Kaplan,QA Engineer II,Dec 2021 - Jul 2024 · 2 yrs 8 mos,", QA Engineer II at Kaplan",HSC,https://media.licdn.com/dms/image/v2/C5603AQF2KvxA-x4Dww/profile-displayphoto-shrink_400_400/profile-displayphoto-shrink_400_400/0/1661330492216?e=1733961600&v=beta&t=5LOpkUYpAEkcN59TsMjiyzUmM3zeFX5-Iyb3UJVxGkI,"sathish.a@kaplan.com, sa@kaplanco.com, sathish.a@bit.ly",sathishravias@gmail.com,"sathish.a@kaplan.com, sa@kaplanco.com, sathish.a@bit.ly",sequenceAssigned,"1-800-527-8378,1-212-997-5883,800.636.9517",,"1-800-527-8378,1-212-997-5883,800.636.9517",,Yes,10/7/2024,10/7/2024,10/20/2024,IN-progress,https://www.linkedin.com/in/sathish-a-r-933b48150,11-50 employees,11-50 employees
Kapil Rathore,My First Folder,krkapilrathore,Kapil Rathore,Kapil,Rathore,"Hi, I'm Kapil Rathore, a CSE graduate, with 5+ years of experience in Mobile Application Development & UI/UX Design. During this period I was involved in the development of products in different domains like fin-tech, healthcare etc.Worked on various features including but not limited to user notifications, reminders, databases, network connections, chatting frameworks, custom UI design etc. Experience with reactive and functional programming paradigms and test driven development.I widely try to adopt the latest and best practices in the industry regarding the code I write (modular, maintainable, extensible, well-tested) and the apps I build for users (better user experience).","Kota, Rajasthan, India",Kota,Grab · Full-time,https://media.licdn.com/dms/image/v2/C510BAQGDlPEJILPXbw/company-logo_100_100/company-logo_100_100/0/1630575649647/grabapp_logo?e=1736380800&v=beta&t=T3NbxeKXpNoOp-oi_c3CKTCjoOI8HER5nePgzZQT-bA,Mobile Engineer,Dec 2022 - Present · 1 yr 11 mos,Grab · Full-time,Mobile Enginner,Aug 2021 - Nov 2022 · 1 yr 4 mos,"Passed LinkedIn Skill Assessment, ",2011 - 2013,https://media.licdn.com/dms/image/v2/C5603AQGJ3P7XoyyTsQ/profile-displayphoto-shrink_400_400/profile-displayphoto-shrink_400_400/0/1517275317510?e=1733961600&v=beta&t=MDEC53IgbzVZqdVjITJtDBGY2YF9rTcVFkmPC9cTw9s,"kapil.rathore@grab.com, kapil.rathore@grabtaxi.com",krkapilrathore@gmail.com,"kapil.rathore@grab.com, kapil.rathore@grabtaxi.com",sequenceAssigned,"6596841256,+659 684 1256,8056799347,1-888-565-0058,5863091683",9783553125,"6596841256,+659 684 1256,8056799347,1-888-565-0058,5863091683",,Yes,10/7/2024,10/7/2024,10/20/2024,Open,https://www.linkedin.com/in/krkapilrathore,,
Mahalakshmi Renganath,My First Folder,mahalakshmi-renganath,Mahalakshmi Renganath,Mahalakshmi,Renganath,"Hi!! I'm Mahalakshmi Renganath . A enthusiastic Post Graduate in Computer Applications with top-notch programming skills. Got Certification in ""Salesforce Platform App Builder"" and a ""Mulesoft Certified Developer"". Knowing Salesforce along with Mulesoft is an added advantage. Loved to play with the components in the Mule and got a chance to work with many external systems and designing API's . It amazed with it's features.Have worked in Healthcare Demo projects where I get a wider view on Healthcare and it's digitilization and the exchange of data between system.","Tiruchirappalli, Tamil Nadu, India",Tiruchirappalli,MST Solutions,https://media.licdn.com/dms/image/v2/D4E0BAQGUleZCQ0fQ_A/company-logo_100_100/company-logo_100_100/0/1664305557542/mstsolutions_logo?e=1736985600&v=beta&t=PkjIGqQFRXN6VSVq--jI9DUfC5He1VXWe8QNGPwt2P4,Software Engineer II,Apr 2022 - Present · 2 yrs 7 mos,MST Solutions,,,", ","Bachelor of Computer Applications, Computer Science","data:image/gif;base64,R0lGODlhAQABAIAAAAAAAP///yH5BAEAAAAALAAAAAABAAEAAAIBRAA7",,,,sequenceAssigned,,,,,No,10/11/2024,10/11/2024,10/20/2024,,https://www.linkedin.com/in/mahalakshmi-renganath,51-200 employees,51-200 employees
Kousalya G,My First Folder,kousalya-g-0056a716b,Kousalya G,Kousalya,G,,India,India,Mastek · Full-time,https://media.licdn.com/dms/image/v2/D4D0BAQH_Vr13cQq2BQ/company-logo_100_100/company-logo_100_100/0/1719831464267/mastek_logo?e=1736985600&v=beta&t=bxcOXRp-E2GJEudGchc8yw80kaqxNjs4B3UgIfXuh5Y,Software Quality Analyst III - Salesforce Business Unit,Jul 2022 - Present · 2 yrs 4 mos,Mastek · Full-time,Software Quality Analyst II,Jul 2021 - Feb 2022 · 8 mos,,,https://media.licdn.com/dms/image/v2/C5603AQFlI825QyvskQ/profile-displayphoto-shrink_400_400/profile-displayphoto-shrink_400_400/0/1602766403817?e=1733961600&v=beta&t=nzqK8pHi3IczGZQ_AJ0bHjIBuJKEXWPXNBkN1uW7yUg,kousalya.g@mastek.com,gkousi15@gmail.com,kousalya.g@mastek.com,sequenceAssigned,+1-732-590-6434,,+1-732-590-6434,,Yes,10/11/2024,10/11/2024,10/20/2024,,https://www.linkedin.com/in/kousalya-g-0056a716b,"5,001-10,000 employees","5,001-10,000 employees"
Sujitha Kumar,My First Folder,sujitha-kumar-2a09b959,Sujitha Kumar,Sujitha,Kumar,"8+ years of experience in Salesforce Project Management, Salesforce Administration, Configuration, Data Migration, Salesforce QA and Deployment across Public Sector, Healthcare and Education domains. Contributed in requirement analysis, design, development, testing and deployment of the SFDC application. ","Tiruchirappalli, Tamil Nadu, India",Tiruchirappalli,Mastek · Full-time,https://media.licdn.com/dms/image/v2/D4D0BAQH_Vr13cQq2BQ/company-logo_100_100/company-logo_100_100/0/1719831464267/mastek_logo?e=1736985600&v=beta&t=bxcOXRp-E2GJEudGchc8yw80kaqxNjs4B3UgIfXuh5Y,Project Manager,Aug 2022 - Present · 2 yrs 3 mos,Mastek · Full-time,Tech Lead,Jul 2016 - Jan 2021 · 4 yrs 7 mos,", ","Bachelor of Science (B.Sc.), Computer Science","data:image/gif;base64,R0lGODlhAQABAIAAAAAAAP///yH5BAEAAAAALAAAAAABAAEAAAIBRAA7",sujitha.kumar@mastek.com,,sujitha.kumar@mastek.com,sequenceAssigned,+1-732-590-6434,,+1-732-590-6434,,Yes,10/11/2024,10/11/2024,10/20/2024,,https://www.linkedin.com/in/sujitha-kumar-2a09b959,"5,001-10,000 employees","5,001-10,000 employees"